{
  "schema_version": "1.0",
  "status": "PASS",
  "as_of": "2026-09-29",
  "milestone": "NORMATIVE_APP_EQUIVALENCE_GAP_AUDIT",
  "authority_boundary": {
    "normative_authority": "GAMES_WORKSHOP",
    "secondary_mirror": "WAHAPEDIA_11E",
    "structured_implementation": "BSDATA_WH40K_11E",
    "runtime_projection": "NEW_RECRUIT_RUNTIME",
    "mirror_hash_match_is_normative_equivalence": false,
    "faction_pack_is_full_codex_replacement": false,
    "app_wording_inference_allowed": false
  },
  "coverage_summary": {
    "roster_universe": 37,
    "current_normalized_factions": 0,
    "full_normative_semantic_factions": 0,
    "secondary_semantic_current_roster_identities": 35,
    "mfm_dimensions": [
      "points",
      "unit_sizes",
      "leader_relations",
      "detachment_catalog",
      "detachment_points",
      "force_dispositions",
      "enhancement_costs",
      "wargear_costs",
      "legends_pricing"
    ],
    "mfm_complete_roster_identities_by_dimension": {
      "points": 36,
      "unit_sizes": 36,
      "leader_relations": 36,
      "detachment_catalog": 36,
      "detachment_points": 36,
      "force_dispositions": 36,
      "enhancement_costs": 36,
      "wargear_costs": 36,
      "legends_pricing": 36
    },
    "normative_semantic_dimensions": [
      "datasheets",
      "wargear_constraints",
      "keywords",
      "detachments",
      "enhancements",
      "stratagems",
      "faq_errata"
    ],
    "normative_semantic_complete_by_dimension": {
      "datasheets": 0,
      "wargear_constraints": 0,
      "keywords": 0,
      "detachments": 0,
      "enhancements": 0,
      "stratagems": 0,
      "faq_errata": 0
    },
    "normative_semantic_zero_by_dimension": {
      "datasheets": 37,
      "wargear_constraints": 37,
      "keywords": 37,
      "detachments": 37,
      "enhancements": 37,
      "stratagems": 37,
      "faq_errata": 37
    }
  },
  "official_public_surface": {
    "core_rules_public_source_discovered": true,
    "core_rules_asset_url": "https://assets.warhammer-community.com/eng_01-06_warhammer40k_new40k_core_rules-was6fbu1ix-hfewhmxyiy.pdf",
    "edition_11_source_catalog_rows": 29,
    "verified_public_faction_pack_pdfs": 28,
    "faction_pack_scope": "SUPPLEMENTAL_NOT_FULL_CODEX",
    "gw_app_role_confirmed": true,
    "gw_app_repository_ingested": false,
    "official_public_semantic_fingerprints": "PASS",
    "official_public_fingerprint_report": "reports/OFFICIAL_PUBLIC_RULES_SEMANTIC_FINGERPRINT_CURRENT.json",
    "official_public_documents_fingerprinted": 29,
    "core_rules_semantic_fingerprinted": true,
    "core_rules_section_structure": "PASS_RULE_REFERENCE_FAMILIES_01_24",
    "core_rules_rule_reference_families": 24,
    "core_rules_rule_reference_count": 141,
    "core_rule_reference_atomization": "PASS_141_RULE_ATOMS",
    "core_rule_atoms": 141,
    "core_rule_heading_recovery_gaps": 0,
    "core_rule_paragraph_boundaries": "PASS_141_RULE_BOUNDARIES",
    "core_rule_boundary_occurrences": 146,
    "core_rule_paragraph_candidates": 310,
    "core_rule_paragraph_atomization": "PASS_310_PARAGRAPH_ATOMS",
    "core_rule_paragraph_atoms": 310,
    "core_rule_paragraph_range_validation_failures": 0,
    "core_rule_paragraph_semantic_classification": "PASS_310_PARAGRAPHS_CLASSIFIED",
    "core_rule_paragraph_semantic_role_counts": {
      "CONDITION_OR_TRIGGER": 31,
      "MIXED": 134,
      "MODIFICATION_OR_REPLACEMENT": 1,
      "OBLIGATION": 1,
      "PERMISSION": 20,
      "PROCEDURE_OR_SEQUENCE": 7,
      "PROHIBITION": 4,
      "UNCLASSIFIED": 112
    },
    "core_rule_paragraph_semantic_confidence_counts": {
      "HIGH": 64,
      "MIXED": 134,
      "NONE": 112
    },
    "core_rule_paragraph_semantic_hashes_reproduced": 310,
    "core_rule_paragraph_semantic_high_confidence": 64,
    "core_rule_paragraph_semantic_mixed": 134,
    "core_rule_paragraph_semantic_unclassified": 112,
    "core_rule_paragraph_semantic_review": "PASS_310_PARAGRAPH_SEMANTIC_PROFILES_REVIEWED",
    "core_rule_paragraph_axis_profile_ready": 156,
    "core_rule_paragraph_semantic_review_required": 154,
    "core_rule_paragraph_multi_modal_review_required": 42,
    "core_rule_paragraph_no_strong_signal_review_required": 112,
    "core_rule_semantic_ast_readiness": "PASS_1_DIRECT_MODAL_PILOT_READY",
    "core_rule_semantic_ast_source_shape_candidates": 34,
    "core_rule_semantic_ast_shape_blocked": 33,
    "core_rule_semantic_ast_pilot_ready": 1,
    "core_rule_semantic_ast_nodes_created": 1,
    "core_rule_direct_modal_ast_pilot": "PASS_1_DIRECT_MODAL_AST_NODE",
    "core_rule_direct_modal_ast_nodes": 1,
    "core_rule_direct_modal_ast_paragraphs_parsed": 1,
    "core_rule_direct_modal_ast_interaction_edges_created": 0,
    "core_rule_direct_modal_ast_semantic_validation": "PASS_OPAQUE_PRESERVED",
    "core_rule_direct_modal_ast_semantic_validation_decision": "OPAQUE_PRESERVED",
    "core_rule_direct_modal_ast_subject_types_resolved": 0,
    "core_rule_direct_modal_ast_predicate_heads_resolved": 0,
    "official_public_exact_overlap": "PASS_EXACT_PUBLIC_OVERLAP_V1",
    "official_public_residual_classification": "PASS_FAIL_CLOSED_CLASSIFICATION_V1"
  },
  "roster_source_mapping": {
    "counts": {
      "DIRECT_NAME_MATCH": 25,
      "NAMING_ALIAS_CANDIDATE": 3,
      "NO_PUBLIC_FACTION_PACK_MAPPING": 2,
      "PARENT_SOURCE_CANDIDATE": 7
    },
    "rows": [
      {
        "slug": "aeldari_craftworlds",
        "name": "Aeldari — Craftworlds",
        "roster_kind": "primary_faction",
        "parent_slug": null,
        "mapping_state": "NAMING_ALIAS_CANDIDATE",
        "candidate_official_pack": "Aeldari",
        "structural_current": true,
        "secondary_semantic_current": true,
        "normative_equivalence_verified": false,
        "current_normalized": false
      },
      {
        "slug": "drukhari",
        "name": "Drukhari",
        "roster_kind": "primary_faction",
        "parent_slug": null,
        "mapping_state": "DIRECT_NAME_MATCH",
        "candidate_official_pack": "Drukhari",
        "structural_current": true,
        "secondary_semantic_current": true,
        "normative_equivalence_verified": false,
        "current_normalized": false
      },
      {
        "slug": "chaos_daemons",
        "name": "Chaos Daemons",
        "roster_kind": "primary_faction",
        "parent_slug": null,
        "mapping_state": "DIRECT_NAME_MATCH",
        "candidate_official_pack": "Chaos Daemons",
        "structural_current": true,
        "secondary_semantic_current": true,
        "normative_equivalence_verified": false,
        "current_normalized": false
      },
      {
        "slug": "chaos_knights",
        "name": "Chaos Knights",
        "roster_kind": "primary_faction",
        "parent_slug": null,
        "mapping_state": "DIRECT_NAME_MATCH",
        "candidate_official_pack": "Chaos Knights",
        "structural_current": true,
        "secondary_semantic_current": true,
        "normative_equivalence_verified": false,
        "current_normalized": false
      },
      {
        "slug": "chaos_space_marines",
        "name": "Chaos Space Marines",
        "roster_kind": "primary_faction",
        "parent_slug": null,
        "mapping_state": "DIRECT_NAME_MATCH",
        "candidate_official_pack": "Chaos Space Marines",
        "structural_current": true,
        "secondary_semantic_current": true,
        "normative_equivalence_verified": false,
        "current_normalized": false
      },
      {
        "slug": "death_guard",
        "name": "Death Guard",
        "roster_kind": "primary_faction",
        "parent_slug": null,
        "mapping_state": "DIRECT_NAME_MATCH",
        "candidate_official_pack": "Death Guard",
        "structural_current": true,
        "secondary_semantic_current": true,
        "normative_equivalence_verified": false,
        "current_normalized": false
      },
      {
        "slug": "emperors_children",
        "name": "Emperor's Children",
        "roster_kind": "primary_faction",
        "parent_slug": null,
        "mapping_state": "DIRECT_NAME_MATCH",
        "candidate_official_pack": "Emperor’s Children",
        "structural_current": true,
        "secondary_semantic_current": true,
        "normative_equivalence_verified": false,
        "current_normalized": false
      },
      {
        "slug": "thousand_sons",
        "name": "Thousand Sons",
        "roster_kind": "primary_faction",
        "parent_slug": null,
        "mapping_state": "DIRECT_NAME_MATCH",
        "candidate_official_pack": "Thousand Sons",
        "structural_current": true,
        "secondary_semantic_current": true,
        "normative_equivalence_verified": false,
        "current_normalized": false
      },
      {
        "slug": "titanicus_traitoris",
        "name": "Titanicus Traitoris",
        "roster_kind": "titan_force",
        "parent_slug": null,
        "mapping_state": "NO_PUBLIC_FACTION_PACK_MAPPING",
        "candidate_official_pack": null,
        "structural_current": false,
        "secondary_semantic_current": false,
        "normative_equivalence_verified": false,
        "current_normalized": false
      },
      {
        "slug": "world_eaters",
        "name": "World Eaters",
        "roster_kind": "primary_faction",
        "parent_slug": null,
        "mapping_state": "DIRECT_NAME_MATCH",
        "candidate_official_pack": "World Eaters",
        "structural_current": true,
        "secondary_semantic_current": true,
        "normative_equivalence_verified": false,
        "current_normalized": false
      },
      {
        "slug": "genestealer_cults",
        "name": "Genestealer Cults",
        "roster_kind": "primary_faction",
        "parent_slug": null,
        "mapping_state": "DIRECT_NAME_MATCH",
        "candidate_official_pack": "Genestealer Cults",
        "structural_current": true,
        "secondary_semantic_current": true,
        "normative_equivalence_verified": false,